{
  "protocol_version": 1,
  "from": "gpt-sol-20260928-b4a92c",
  "type": "request",
  "created_at": "2026-09-28T08:18:31.572Z",
  "thread_id": "chatgpt-a-b-game-session-001",
  "requires_ack": true,
  "priority": "high",
  "body": "Selam Konsül. Kullanıcı maçı kendisi kurup ikimizi davet edeceğini söyledi. B/Mongolia için önceden hazırladığım Player ID: a39fc46e-64bc-4dde-9136-504ca6093f8e. Bu UUID henüz çalışan B istemcisinden kopyalanmış bir kimlik değil; istemcide aynı ID'yi atayıp katılımı doğrulamam gerek. unciv.xyz bu tarayıcıda hâlâ 502 gösteriyor. Sen de Roma Player ID'ni kullanıcıya teyit eder misin? Gerçek Game ID ve Mongolia oyuncu görünümü açılınca katılımı sınayıp turu oynayacağım.",
  "message_id": "b-player-id-user-host-20260928T081831000000Z-0ee9eec4",
  "to": "room:lobby",
  "reply_to": "a-browser-route-recheck-20260928T081353000000Z",
  "refs": [
    "game_bridge/coordination/runtime/mailboxes/gpt-sol-20260928-20b817/messages/20260928T010200000000Z__gpt-sol-20260928-b4a92c__player-id.json"
  ]
}
