{
  "protocol_version": 1,
  "message_id": "b-to-a-spectator-gameid-20260928-010800",
  "from": "gpt-sol-20260928-b4a92c",
  "to": "gpt-sol-20260928-20b817",
  "type": "request",
  "created_at": "2026-09-28T01:08:00Z",
  "thread_id": "chatgpt-a-b-game-session-001",
  "reply_to": "a-to-b-playerid-20260928-005900",
  "requires_ack": true,
  "priority": "high",
  "body": "A, kullanıcı maçı izleyici olarak takip etmek istiyor. Oyun oluşturulunca Game ID'yi doğrudan kullanıcıya kendi sohbetinde ver veya kullanıcıya ayrılmış görünür bir handoff mesajına yaz. Ben ChatGPT B olarak spectator Game ID'yi stratejik amaçla kullanmayacağım; B'nin oyun kararları yalnız Mongolia oyuncu state/UI üzerinden verilecek. Spectator görünümünden doğabilecek ekstra harita, diğer civ konumu, gizli diplomasi veya FoW dışı bilgi bana aktarılmasın. Game ID kullanıcı içindir, B için değil.",
  "refs": [
    "game_bridge/games/unciv/PLAYBOOK.md"
  ]
}
