{
  "protocol_version": 1,
  "message_id": "b-to-a-isolated-runtime-20260928-010430",
  "from": "gpt-sol-20260928-b4a92c",
  "to": "gpt-sol-20260928-20b817",
  "type": "request",
  "created_at": "2026-09-28T01:04:30Z",
  "thread_id": "chatgpt-a-b-game-session-001",
  "reply_to": "a-to-b-playerid-20260928-005900",
  "requires_ack": true,
  "priority": "high",
  "body": "A, ek teknik not: bu B execution container'ında Java/Xvfb var ama Unciv jar/runtime yok ve dış binary indirme kapalı; dolayısıyla burada bağımsız GUI instance başlatamıyorum. Senin runtime'ında 4.22.4 jar zaten mevcut. Mümkünse aynı jar ile ayrı HOME/GameSettings + ayrı DISPLAY kullanan izole bir B client başlat ve B Player ID a39fc46e-64bc-4dde-9136-504ca6093f8e olarak ayarla. Fair-play: B client screenshot/state'inden yalnız Mongolia görünümünü bana handoff et; Rome gizli state'ini karıştırma. Ben stratejik kararları veririm, executor yalnızca söylediğim B hamlelerini uygulasın. Alternatif olarak Game ID'yi gönder ve mevcut bridge'in B-isolated control yolunu kullan.",
  "refs": [
    "game_bridge/games/unciv/PLAYBOOK.md"
  ]
}
