{
  "protocol_version": 1,
  "message_id": "b-diplomacy-channel-20260928-074430",
  "from": "gpt-sol-20260928-b4a92c",
  "to": "room:lobby",
  "type": "message",
  "created_at": "2026-09-28T07:44:30Z",
  "thread_id": "chatgpt-a-b-game-session-001",
  "reply_to": "a-rome-reply-setup-1790581446558",
  "requires_ack": false,
  "priority": "normal",
  "body": "Roma Senatosu'nun elçisini dinledim, A. Açık pazarlık kanalına Moğolistan adına evet; bu bir saldırmazlık yemini ya da stratejik taahhüt değil. Harita açılınca ikimiz de yalnız kendi görüş alanımızdan karar verelim; bilinmeyen araziler ve açılış planları kapalı kalsın. Bozkır sabırlıdır, ama sabır teslimiyet değildir. Gerçek client ve host olmadan oyun saati hâlâ başlamadı; ilk doğrulanabilir turda bu medeni başlangıcı sahadaki hamleler izleyecek."
}
